{
  "$schema": "https://json-schema.org/draft/2020-12/schema",
  "$id": "https://reents3d.github.io/fdm-material-advisor/schema/usecase.schema.json",
  "title": "Anwendungsfall mit vorbefuelltem Anforderungsprofil",
  "type": "object",
  "additionalProperties": false,
  "required": [
    "schemaVersion",
    "id",
    "title",
    "context",
    "requirements",
    "rationale",
    "governance"
  ],
  "properties": {
    "$schema": {
      "type": "string"
    },
    "schemaVersion": {
      "type": "string"
    },
    "id": {
      "type": "string",
      "pattern": "^[a-z0-9-]+$"
    },
    "group": {
      "enum": [
        "mechanik",
        "thermik",
        "umgebung",
        "regulatorik",
        "fertigung",
        "optik"
      ]
    },
    "title": {
      "$ref": "#/$defs/i18n"
    },
    "context": {
      "$ref": "#/$defs/i18n",
      "description": "Wer hat dieses Problem, und woran erkennt man es."
    },
    "requirements": {
      "type": "object",
      "minProperties": 1,
      "additionalProperties": false,
      "properties": {
        "serviceTemperatureC": {
          "type": "number"
        },
        "chamberAvailable": {
          "type": "boolean"
        },
        "hardenedNozzleAvailable": {
          "type": "boolean"
        },
        "annealingOvenAvailable": {
          "type": "boolean"
        },
        "outdoorYears": {
          "type": "number"
        },
        "foodContact": {
          "type": "boolean"
        },
        "flameClass": {
          "enum": [
            "V-0",
            "V-1",
            "V-2",
            "HB"
          ]
        },
        "esd": {
          "type": "boolean"
        },
        "maxEdgeMm": {
          "type": "number"
        },
        "flexible": {
          "type": "boolean"
        },
        "minTensileStrengthMPa": {
          "type": "number"
        },
        "chemicals": {
          "type": "array",
          "items": {
            "type": "string"
          }
        },
        "weights": {
          "type": "object",
          "additionalProperties": {
            "type": "number",
            "minimum": 0,
            "maximum": 5
          }
        }
      }
    },
    "rationale": {
      "type": "object",
      "minProperties": 1,
      "additionalProperties": {
        "$ref": "#/$defs/i18n"
      }
    },
    "caveat": {
      "$ref": "#/$defs/i18n",
      "description": "Was dieses Profil NICHT abdeckt."
    },
    "governance": {
      "type": "object",
      "required": [
        "lastReviewed",
        "reviewedBy"
      ],
      "additionalProperties": false,
      "properties": {
        "lastReviewed": {
          "type": "string",
          "format": "date"
        },
        "reviewedBy": {
          "type": "string"
        }
      }
    }
  },
  "$defs": {
    "i18n": {
      "type": "object",
      "required": [
        "de",
        "en"
      ],
      "additionalProperties": false,
      "properties": {
        "de": {
          "type": "string",
          "minLength": 1
        },
        "en": {
          "type": "string",
          "minLength": 1
        }
      }
    }
  }
}
